{"attempt":1,"parent_commit":"d71b2ed","patch_ref":"d71b2ed","median_ms":8347,"delta_pct":-1.34,"test_count":2849,"pass_count":2849,"invariant_ok":true,"status":"discard","description":"control: default target reproducibility"}
{"attempt":2,"parent_commit":"d71b2ed","patch_ref":"8ae23f4","median_ms":8161,"delta_pct":-3.53,"test_count":2849,"pass_count":2849,"invariant_ok":true,"status":"keep","description":"testConcurrency=8 (default is cores-1=7)"}
{"attempt":3,"parent_commit":"8ae23f4","patch_ref":"f15ca5b","median_ms":7957,"delta_pct":-5.95,"test_count":2849,"pass_count":2849,"invariant_ok":true,"status":"keep","description":"testConcurrency=16 (2x cores)"}
{"attempt":4,"parent_commit":"f15ca5b","patch_ref":"436f93d","median_ms":8445,"delta_pct":-0.18,"test_count":2849,"pass_count":2849,"invariant_ok":true,"status":"discard","description":"testConcurrency=32 — oversubscription regression"}
{"attempt":5,"parent_commit":"f15ca5b","patch_ref":"6ce2dd1","median_ms":7958,"delta_pct":-5.93,"test_count":2849,"pass_count":2849,"invariant_ok":true,"status":"discard","description":"concurrency=16 + old-space 8GB — noise-level, no gain over retained"}
{"attempt":6,"parent_commit":"f15ca5b","patch_ref":"1f9df40","median_ms":0,"delta_pct":0,"test_count":0,"pass_count":0,"invariant_ok":false,"status":"crash","description":"no-turbo-fan — NODE_OPTIONS disallow, harness fail-closed at build phase"}
{"attempt":7,"parent_commit":"f15ca5b","patch_ref":"493fc43","median_ms":8267,"delta_pct":-2.28,"test_count":2849,"pass_count":2849,"invariant_ok":true,"status":"discard","description":"testConcurrency=24 — worse than retained 16"}
{"attempt":8,"parent_commit":"f15ca5b","patch_ref":"dd30dbf","median_ms":7947,"delta_pct":-6.06,"test_count":2849,"pass_count":2849,"invariant_ok":true,"status":"keep","description":"testConcurrency=12 — equal time, lower resource than 16 (simplicity rule)"}
{"attempt":9,"parent_commit":"dd30dbf","patch_ref":"b7a4e19","median_ms":7943,"delta_pct":-6.11,"test_count":2849,"pass_count":2849,"invariant_ok":true,"status":"discard","description":"semi-space 64MB — noise, no gain"}
{"attempt":10,"parent_commit":"dd30dbf","patch_ref":"5d9c63c","median_ms":8040,"delta_pct":-4.96,"test_count":2849,"pass_count":2849,"invariant_ok":true,"status":"discard","description":"testConcurrency=14 — noise band, no gain over 12"}
{"attempt":11,"parent_commit":"dd30dbf","patch_ref":"1ac0e7c","median_ms":7860,"delta_pct":-7.09,"test_count":2849,"pass_count":2848,"invariant_ok":false,"status":"discard","description":"testConcurrency=10 — fastest but invariant FAIL (1/3 runs not green, flaky); contract rejected speed without reliability. rerun green 7902"}
